<?xml version="1.0" encoding="ISO-8859-1"?>
<!-- edited martin@yafra.org -->
<!DOCTYPE TRAVELDB SYSTEM "G:\work\cvswork\mapo\xml\tdb-login.dtd">
<TRAVELDB version="1.0">
	<STATUS>
		<CODE>0</CODE>
		<MSG>OK</MSG>
	</STATUS>
	<LOGIN version="1.0">
		<DBNAME>mapo</DBNAME>
		<USER>mwn</USER>
		<PWD>mwn</PWD>
		<CLIENTHOSTNAME>webpc</CLIENTHOSTNAME>
		<FLAG>1</FLAG>
		<UID>1</UID>
		<BCHST ID="-1">Alpha</BCHST>
		<SECLEVEL ID="1">Admin</SECLEVEL>
		<LANG ID="-1">German</LANG>
		<COUNTRY ID="-1">Switzerland</COUNTRY>
		<DLTT ID="-1">Schiff</DLTT>
		<DLT ID="-1">Aria</DLT>
		<KAT ID="-1">Basic</KAT>
		<DLAT ID="-1">Schiffreise</DLAT>
		<DLNT ID="-1">Erwachsene</DLNT>
		<SAI ID="-1">Sommer 2004</SAI>
		<PRG ID="-1">USA</PRG>
		<STARTTIME>-1</STARTTIME>
		<ENDTIME>-1</ENDTIME>
		<RANGE>0</RANGE>
	</LOGIN>
</TRAVELDB>
